{"architecture":"aarch64","build_id":"fixture-build-1","entrypoint":"automation-tool-executor","executor_version":"0.1.0","files":[{"path":"_internal/runtime.dat","sha256":"64d4736a624c97295c0bf70f436e42aac284961217f681e86ad700adbfb39118","size":22},{"path":"automation-tool-executor","sha256":"05c839cd4164bafb2c5121a8b0c78e04c2091c1e6c24cb26ef990bd6c5d1bb5f","size":23}],"manifest_version":"1","package_sha256":"ea4997a3b73400f187472b8927872d8a3ae9f7a8d7b4537d1fdf6677d56d1019","package_size":45,"platform":"macos"}
